{
    "manifestVersion": "1",
    "generatedBy": "0.1.3",
    "version": "0.1.0",
    "generated": "2026-02-18T08:14:47.881Z",
    "baseTemplate": "compose",
    "baseImage": "bookworm",
    "overlays": ["prometheus", "loki", "otel-collector", "grafana", "nodejs", "postgres", "redis"],
    "containerName": "Compose-Based Development"
}
