{
    "manifestVersion": "1",
    "generatedBy": "0.1.3",
    "version": "0.1.0",
    "generated": "2026-02-18T08:14:54.161Z",
    "baseTemplate": "compose",
    "baseImage": "bookworm",
    "overlays": ["jaeger", "prometheus", "otel-collector", "dotnet", "postgres"],
    "containerName": "Compose-Based Development"
}
